Name,Purpose
Rodriguez PLC,Upgradable motivating support for reinvent customized deliverables
Boone-Stark,Integrated value-added access for orchestrate robust web services
Skinner Inc,Automated value-added attitude for aggregate impactful e-business
Dalton PLC,Re-contextualized high-level analyzer for extend holistic platforms
Lloyd PLC,Seamless asynchronous emulation for e-enable compelling relationships
"Adams, Gordon and Williams",Business-focused value-added methodology for seize efficient niches
Carpenter LLC,Progressive homogeneous info-mediaries for leverage cutting-edge web-readiness
Hale-Mclaughlin,Organic optimizing throughput for embrace bricks-and-clicks channels
Gutierrez LLC,Seamless heuristic algorithm for cultivate cutting-edge mindshare
"Vargas, Jones and White",Enhanced mobile customer loyalty for orchestrate cutting-edge portals
Henderson-Galloway,Robust fresh-thinking Local Area Network for iterate B2C partnerships
Ponce and Sons,Seamless well-modulated knowledge user for harness value-added content
"Moore, Petty and Nelson",Extended background monitoring for engage vertical interfaces
Berger-Johnson,Optional composite standardization for orchestrate distributed systems
Rogers-Patton,Innovative client-driven info-mediaries for integrate cutting-edge ROI
"Frey, Holden and Roberts",Object-based dynamic attitude for innovate B2C channels
Cook-Owen,Extended tertiary help-desk for incentivize visionary relationships
Miller Inc,Open-source background open system for extend sticky bandwidth
Edwards-Brown,Cross-group global solution for grow e-business action-items
Winters Group,Polarized transitional structure for strategize granular networks
"Quinn, Smith and Adams",User-friendly upward-trending product for streamline best-of-breed content
Best-Ray,Re-engineered radical moratorium for target clicks-and-mortar action-items
"Murphy, Crane and Malone",Pre-emptive methodical website for harness global initiatives
Trevino-Maxwell,Upgradable intermediate Local Area Network for grow impactful deliverables
"Holder, Smith and Thornton",Automated composite encoding for expedite virtual mindshare
"Wilson, Martin and Curtis",Persistent even-keeled groupware for envisioneer ubiquitous e-tailers
"Snyder, Shaw and Taylor",User-centric directional approach for deploy granular supply-chains
Lopez-Barrett,Programmable zero administration budgetary management for leverage wireless methodologies
"Thomas, Willis and Smith",Cross-group zero tolerance capability for empower efficient content
"Kemp, Thompson and Smith",Implemented demand-driven portal for e-enable revolutionary metrics
Leach-Reynolds,Ergonomic homogeneous secured line for optimize robust applications
Rivera-Rodriguez,Persevering background archive for engineer cutting-edge web services
"Tran, Salas and Mason",Upgradable global migration for envisioneer global web services
Campbell and Sons,Synergistic client-server Graphical User Interface for transition rich relationships
Krueger LLC,Vision-oriented human-resource knowledge user for utilize bleeding-edge mindshare
"Young, Leonard and Dawson",Multi-layered actuating data-warehouse for enable dot-com paradigms
"Wyatt, Perry and Everett",Team-oriented motivating groupware for deploy enterprise initiatives
Gould-Kennedy,Synchronized transitional instruction set for aggregate rich web-readiness
Dalton-Carlson,Cross-group high-level projection for generate next-generation eyeballs
Morales-Hardy,Balanced 5thgeneration policy for matrix one-to-one communities
Osborne-Rivera,Persevering bifurcated benchmark for deliver robust e-business
Reed Group,Decentralized 24/7 adapter for streamline collaborative deliverables
Miller-Lindsey,Team-oriented needs-based neural-net for disintermediate dynamic content
Gonzales-Anthony,Universal web-enabled workforce for whiteboard killer systems
Brandt-Davis,Ameliorated user-facing service-desk for re-intermediate strategic e-commerce
Garza and Sons,Profit-focused background initiative for matrix killer action-items
Yoder-Hammond,Right-sized directional open architecture for expedite end-to-end e-markets
Alvarado-Cole,Phased next generation collaboration for orchestrate visionary relationships
"Bird, Griffin and Foster",Persistent neutral collaboration for e-enable revolutionary paradigms
Oliver and Sons,Multi-tiered systematic application for facilitate turn-key e-commerce