Name,Purpose
Villanueva LLC,Virtual next generation website for productize seamless schemas
"Farmer, Lang and Johnson",Function-based tangible projection for deploy turn-key systems
Smith-Graves,Cross-group human-resource core for synergize compelling models
Rodriguez Inc,Decentralized reciprocal challenge for iterate visionary ROI
Glass Ltd,Enhanced eco-centric workforce for repurpose sticky architectures
"Jones, Duncan and Nichols",Realigned zero-defect algorithm for engineer global infrastructures
"Santos, Anderson and Williams",Ergonomic context-sensitive focus group for revolutionize frictionless ROI
Wilson-Hines,Switchable multi-state task-force for disintermediate leading-edge experiences
"Little, King and Sutton",Down-sized cohesive paradigm for engineer transparent communities
Mccormick LLC,Reduced maximized ability for exploit impactful relationships
"Moran, Marquez and Thomas",Virtual background moderator for streamline web-enabled web-readiness
Maynard-Reyes,Total solution-oriented budgetary management for harness user-centric solutions
Woods-Miller,Advanced explicit support for aggregate revolutionary web services
King LLC,Cross-group dedicated circuit for engage plug-and-play web services
Roth Inc,Balanced contextually-based moratorium for productize revolutionary portals
Warner and Sons,Decentralized even-keeled secured line for facilitate seamless channels
Peters-Gutierrez,User-centric multi-state productivity for maximize collaborative experiences
"Phillips, Ortiz and Bryan",Up-sized motivating matrix for incubate proactive systems
"Haas, Gonzales and Browning",Ameliorated incremental extranet for unleash virtual info-mediaries
Edwards LLC,Innovative needs-based contingency for mesh B2B experiences
"Gomez, Hunter and Baldwin",Upgradable discrete monitoring for maximize wireless applications
Sutton-Macdonald,Re-engineered directional artificial intelligence for e-enable back-end e-business
"Davis, Benton and Bradshaw",Customer-focused composite solution for harness compelling e-markets
Santiago LLC,Optional neutral database for facilitate e-business niches
"Collins, Johnson and Rocha",Cross-group stable Graphical User Interface for embrace extensible initiatives
Weiss Group,De-engineered maximized installation for cultivate proactive e-services
"Mejia, Sawyer and Howard",Fundamental national moratorium for enhance transparent e-business
"Silva, Maldonado and Anderson",Public-key zero tolerance success for utilize cutting-edge action-items
Walker Inc,Organized needs-based concept for disintermediate web-enabled convergence
Clarke Inc,Optimized interactive methodology for engage front-end convergence
"Bentley, Golden and Savage",Total transitional moderator for re-intermediate bricks-and-clicks platforms
"Daniels, Kim and Malone",Reduced demand-driven installation for synergize bricks-and-clicks web-readiness
"Adams, Edwards and Johnson",Advanced maximized artificial intelligence for benchmark e-business users
Duncan and Sons,Customizable coherent workforce for grow B2B networks
Smith LLC,Persistent intangible core for expedite revolutionary metrics
Vargas-Johnson,Expanded cohesive ability for synergize granular e-tailers
"Miller, Lee and Hernandez",Balanced value-added Graphic Interface for enable customized content
Guzman-Thompson,Streamlined explicit productivity for cultivate interactive methodologies
Long Ltd,Grass-roots 24hour framework for monetize global deliverables
Browning-Sims,User-friendly tertiary application for transition robust bandwidth
Hill-Morris,Persevering non-volatile support for extend sticky channels
Doyle PLC,Enhanced bottom-line orchestration for mesh distributed eyeballs
"Gentry, Wiggins and Love",Assimilated transitional toolset for generate proactive partnerships
"Martin, Cobb and Moreno",Focused secondary secured line for grow robust e-business
Black Ltd,Devolved fault-tolerant approach for empower cross-platform platforms
Brown and Sons,Monitored high-level info-mediaries for reinvent holistic e-commerce
Ellis PLC,Total intangible functionalities for redefine cross-media schemas
Mack-Sims,Cross-group fresh-thinking Internet solution for engineer bricks-and-clicks relationships
Spencer Group,Intuitive scalable architecture for drive wireless relationships
Padilla-Graham,Enterprise-wide object-oriented architecture for leverage 24/7 ROI
"Johns, Johnson and Dalton",Adaptive fresh-thinking array for enhance cross-platform initiatives